id,name,text,trans
0000000000000,あさり先生,アイドル一問一答！\n今日は花海咲季さんの場合です。,偶像一问一答！\n今天是花海咲季的情况。
0000000000000,あさり先生,花海さんはしっかりもので、\nなんでも自分でやってしまいます。,花海是个可靠的人，\n什么事都自己做。
0000000000000,あさり先生,そんな時、プロデューサーとして\nできることは何でしょう？,这种时候，作为培育者\n能做些什么呢？
0000000000000,あさり先生,正解というものはないので、\n一番だというものを選んでくださいね。,没有标准答案，\n请选出你认为最好的。
select,,方向性の舵取り,把握方向
select,,背中を押す,鼓励她
select,,抜け漏れの\nチェック,检查遗漏
0000000000000,{user},自分の世話を自分でするとなると、\n視点がミクロになる可能性があります。,自己照顾自己，\n可能会导致视角变得狭隘。
0000000000000,あさり先生,そこを、プロデューサーならではの\nマクロな視点でサポートする……,在这方面，作为培育者用\n宏观的视角来支持……
0000000000000,あさり先生,うんうん、\nいいんじゃないでしょうか～。,嗯嗯，\n这个方法不错哦。
0000000000000,あさり先生,花海さんが一番輝ける方向を、\nぜひ灯台のように照らしてくださいね！,请像灯塔一样，\n照亮花海最闪耀的方向吧！
0000000000000,{user},自信家ですが、繊細な面も\nもっていますから。,虽然她很自信，但也有\n细腻的一面。
0000000000000,あさり先生,思わぬところで踏み出せないかも？\nなるほどなるほど。,可能会在意想不到的地方停下脚步？\n原来如此。
0000000000000,あさり先生,そんな時はどういう言葉を選ぶかも\n大事になってきますが……,这种时候，选择什么样的话语\n也很重要……
0000000000000,あさり先生,その顔を見ると、どうやら\n心配はいらないみたいですね♪,看你的表情，似乎\n不需要担心呢♪
0000000000000,{user},自分の世話は意外と大変です。\n細かいところは見落とすかも。,照顾自己其实很难。\n可能会忽略细节。
0000000000000,あさり先生,その抜けたところをフォローする。\nこれまた大変です。,弥补那些疏漏。\n这也很不容易。
0000000000000,あさり先生,プロデューサーとして、しっかり\nアイドルを見ておく必要がありますね。,作为培育者，需要认真\n观察偶像。
0000000000000,あさり先生,きっときみなら大丈夫です。\n期待してますよーっ。,我相信你一定能做到。\n期待你的表现。
info,adv_pevent_001_hski_school_004.txt,,
译者,gpt-4o-2024-05-13,,