id,name,text,trans
0000000000000,佑芽,プロデューサーさん！,制作人！
0000000000000,佑芽,ついにこの日が\nやってきましたね！,终于到了这一天了！
0000000000000,{user},いつにも増して\nはりきっていますね、佑芽さん。,今天你特别有干劲呢，佑芽。
0000000000000,佑芽,はいっ！　だって……見ましたか？　\n参加者たちの顔を。,是啊！ 你看到了吗？\n参与者们的表情。
0000000000000,佑芽,みんな、ものすっごい気合ですよ！\nこっちも負けていられませんっ！,大家都很有干劲！ 我们也不能输！
0000000000000,{user},それはそうでしょうね。\nなんといっても……,那是当然的。毕竟……
0000000000000,{user},今日は『<r\=セレクション>選抜試験</r>』ですから。,今天是“选拔考试”。
0000000000000,佑芽,それってなんでしたっけ？,那是什么来着？
0000000000000,{user},夏に行われる大イベントへの\n参加権を得るための――,为了获得夏季大活动的\n参与权——
0000000000000,{user},<r\=ライブ>実践</r>形式の<r\=オーディション>試験</r>になります。,采取实际演出的形式进行的甄选考试。
0000000000000,佑芽,むむっ……聞いたことが\nあるような気がしますよ！,嗯……好像有听说过！
0000000000000,佑芽,そう、確か――,对，没错——
0000000000000,佑芽,『Hatsuboshi IDOL FESTIVAL』！！,“Hatsuboshi IDOL FESTIVAL”！！
0000000000000,{user},その通り。学園一の\nアイドルを決める祭典です。,没错。这是决定学院第一偶像的盛典。
0000000000000,{user},咲季さんとの決戦の場として、\n最高の舞台だと思いませんか？,作为与你姐姐咲季对决的场所，\n是不是最好的舞台？
0000000000000,佑芽,……プロデューサーさん。,……制作人。
0000000000000,佑芽,――はい！　思います！,——是的！ 我也这么认为！
0000000000000,佑芽,重要なオーディション――……\n試験だったんですね、今日って。,今天是很重要的甄选考试——……\n原来是考试啊。
0000000000000,佑芽,お姉ちゃんとの勝負じゃないんだって、\n残念に思っていたんですけど。,虽然觉得不是和姐姐的对决，\n有点遗憾。
0000000000000,佑芽,こんなの……\n絶対負けられないじゃないですか！,但是这样的机会……\n绝对不能输啊！
0000000000000,佑芽,たとえあたしが、\n補欠入学の劣等生でも……,即使我是\n凭补录入学的劣等生……
0000000000000,佑芽,参加者が全員格上のアイドルでも……,即使参与者全都是比我强的偶像……
0000000000000,佑芽,そんなの関係ありません！,这都无所谓！
0000000000000,佑芽,よぉ～～～～～っし、\n一番になってきます！,好～～～～～的，\n我要成为第一！
0000000000000,{user},（ライブが終わるや否や、\nステージに大歓声が降り注いだ）,（演出一结束，\n舞台上响起了热烈的欢呼声）
0000000000000,佑芽,みなさぁーーーーん！　\nありがとうございましたぁ！,大家—————！\n谢谢你们！
0000000000000,{user},お疲れ様でした、佑芽さん。\n圧倒的なパフォーマンスでしたね。,辛苦了，佑芽。\n你表演得非常出色。
0000000000000,{user},ここまでの参加者の中では、\n一番です。,在所有参与者中，\n你是最棒的。
0000000000000,佑芽,はいっ！　あたしやりました、\nプロデューサーさん！,是的！ 我成功了，\n制作人！
0000000000000,佑芽,――って、あたし、\n一番になったんですよ！,——也就是说，\n我成为第一了！
0000000000000,佑芽,あのっ、格上オーラをビシバシ出してた\n人たち全員に勝ってきたんですよ！,我打败了那些\n散发着强者气息的人！
0000000000000,{user},そうですね。,是的。
0000000000000,佑芽,ちっとも驚いてないじゃないですか！？,你一点也不惊讶吗！？
0000000000000,{user},勝つと信じていましたから。\nあらかじめ、伝えてあったはずです。,因为我相信你能赢。\n之前不是就说过了吗。
0000000000000,{user},花海佑芽は、いままさに、\nブレイクスルーを果たしつつあると。,花海佑芽，现在正处于\n突破的关键时刻。
0000000000000,佑芽,………あたし、\nすごく……成長してる？,……我，\n真的在成长吗？
0000000000000,{user},でなければ、\n今日のような結果にはならない。,不然的话，\n今天的结果也不会这样。
0000000000000,{user},さて、信じてくれましたか？\nいまの自分の力を。,那么，你相信了吗？\n现在的自己的力量。
0000000000000,佑芽,でも、あたし、まだまだ\nお姉ちゃんには――――,但是，我还没能\n超越姐姐——
0000000000000,{user},いまだけでいい。花海咲季を\n基準にするのはやめましょう。,暂时不要以花海咲季为标准。
0000000000000,咲季,プロデューサーの言うとおりよ。,制作人说得对。
0000000000000,佑芽,お、お姉ちゃん！？,啊，姐姐！？
0000000000000,咲季,何度も言わせないでくれる？　\n佑芽は、とっても成長してるわ。,不要让我重复说几次了好吗？\n佑芽，你真的成长了很多。
0000000000000,咲季,自分の力量ぐらい、\nちゃんと把握しておきなさい。,要好好了解自己的实力。
0000000000000,咲季,でなきゃ――\n今日戦った相手に失礼でしょ？,不然的话——\n对今天与你对战的对手不礼貌吧？
0000000000000,佑芽,…………………………,…………………………
0000000000000,佑芽,うん……だよね！,嗯……是啊！
0000000000000,佑芽,わかったよ、\nお姉ちゃん……プロデューサーさん！,我知道了，\n姐姐……制作人！
0000000000000,佑芽,あたし……強くなってる！！,我……变得更强了！！
0000000000000,咲季,そう、それでいいわ。\nま、もっとも――,对，就是这样。\n不过，虽然说——
0000000000000,咲季,まだまだ、\nこのわたしには及ばないけどねっ♪,你还远远比不上我呢♪
0000000000000,佑芽,む～……お姉ちゃんは、\n『<r\=セレクション>選抜試験</r>』受けたの？,哼～……姐姐，你参加了\n‘选拔试验’吗？
0000000000000,咲季,そういうの、愚問って言うのよ。\n――そろそろ出番ね。,这种问题，叫愚问哦。\n——马上就到我上场了。
0000000000000,咲季,見てなさい、佑芽。\nあなたが目指す、わたしのライブを！,看好了，佑芽。\n这是你所追求的，我的演唱会！
0000000000000,佑芽,やっぱり……お姉ちゃんは凄いなぁ。\n今日もあたしの――,果然……姐姐好厉害啊。\n今天我也——
0000000000000,佑芽,負け！　とは！　言いませんけど！,不会说输！不会说的！
0000000000000,佑芽,プロデューサーさん。,制作人。
0000000000000,佑芽,以前、あたしに聞きましたよね？\nアイドルへの情熱があるのかって。,你以前问过我，对偶像有没有热情。
0000000000000,佑芽,あの時は、わからなかったこと。,那时候，我还不明白。
0000000000000,佑芽,いまは、ちゃんと答えられます。,现在，我可以清楚地回答了。
0000000000000,佑芽,あたし――,我——
0000000000000,佑芽,アイドルとして\nあの人に勝ちたいです！,作为偶像，\n想要赢过那个人！
0000000000000,佑芽,他の競技じゃダメなんです。\nあたしはお姉ちゃんに勝って、,其他的比赛不行。\n我要赢过姐姐，
0000000000000,佑芽,世界で一番のアイドルになります！,成为世界上最棒的偶像！
0000000000000,佑芽,あれから、何度も何度も考えました。\n視野が狭いのかもって、悩みました。,从那以后，我反复思考了很多次。\n为视野狭窄而烦恼。
0000000000000,佑芽,だけど、何度考えても、\nどんなアイドルを映像で観ても……,但是，无论怎么想，\n无论看多少偶像的表演……
0000000000000,佑芽,答えは変わらないんです。,答案都没有改变。
0000000000000,佑芽,あたしにとって、世界で一番の\nアイドルはお姉ちゃんなんです。,对我来说，世界上最棒的\n偶像就是姐姐。
0000000000000,佑芽,お姉ちゃんに勝てば、\nそれが世界一なんです。,只要赢过姐姐，\n那就是世界第一。
0000000000000,佑芽,プロデューサーさんは、それじゃ\nダメだって言うと思います……けど。,制作人，你可能会说这样不行……不过。
0000000000000,佑芽,誰にも文句は言わせません！\n勝った後のことなんて知りません！,我不会让任何人有意见！\n赢了之后的事我不管！
0000000000000,佑芽,そんなの、お姉ちゃんに勝った後の\n新しいあたしに任せます！,那种事，留给赢过姐姐后的\n新我去解决！
0000000000000,佑芽,どうですか！　まいりましたか！　\nプロデューサーさん！,怎么样！你服气了吗！\n制作人！
select,,いいと思いますよ,我觉得很好
0000000000000,佑芽,えっ？？？？　いいんですか？？？,诶？？？？真的吗？？？
0000000000000,佑芽,前はダメって言ったのに？？？,之前你不是说不行吗？？？
0000000000000,{user},以前の答えとは、同じようで、\n違いますから。では佑芽さん――,之前的回答，虽然看似相同，\n但其实不一样。那么佑芽——
0000000000000,{user},――それでいきましょう。,——就这么决定吧。
0000000000000,佑芽,はいっ！,好的！
0000000000000,佑芽,今後ともよろしくお願いします、\nプロデューサーさん！,今后也请多多关照，\n制作人！
0000000000000,{user},今日のプロデュース状況を\nメモしておこう。,把今天的培育情况\n记录下来。
0000000000000,{user},目標が定まった。\nここからもっと伸びるぞ！,目标已经确定。从这里开始\n会有更多的成长！
info,adv_dear_hume_006.txt,,
译者,gpt-4o-2024-05-13,,