id,name,text,trans
0000000000000,{user},お疲れ様でした。咲季さんは……,辛苦了。咲季小姐呢……
0000000000000,{user},合格です。まずまずの結果でしたね。,合格了。結果還算可以吧。
0000000000000,咲季,うん、ありがとう。,嗯，謝謝。
0000000000000,咲季,ん～……………………,嗯～……………………
0000000000000,咲季,ねぇ、プロデューサー。,嘿，製作人。
0000000000000,咲季,今日のわたし、どうだった？,今天的我，怎麼樣呢？
select,,新たな課題を\n見つけました,找到了新的課題
select,,とても可愛かった,非常可愛
select,,完成度が高かった,完成度很高
0000000000000,咲季,そう！　なら、成果アリね！,對！那麼，可以說是有成果了！
0000000000000,咲季,プロデューサー！　さっそく教え――,製作人！馬上告訴我——
0000000000000,咲季,――って、違うわね。反省会は\n後日のお楽しみにしておくわ。,——咦，不對呢。自我檢討會留到日後再說吧。
0000000000000,咲季,まずはライブに集中しなきゃ。,首先要專心在演唱會上。
0000000000000,咲季,期待してなさい。\nいい気分で歌えそうよ。,期待吧。\n感覺可以心情愉快地唱歌。
0000000000000,咲季,えへへへ…………♡,嘿嘿嘿…………♡
0000000000000,咲季,なぁにその子供みたいな感想～♪,那個，你這種孩子般的評價～♪
0000000000000,咲季,ったくもう……\n仕方のないプロデューサーねっ。,唉呀呀……\n真是無可救藥的製作人呢。
0000000000000,咲季,いい？　いまのわたしには、\nきっとまだ改善すべき点があるはずよ。,好了嗎？現在的我，\n肯定還有需要改進的地方。
0000000000000,咲季,ライブをよく見て、次こそは\nしっかり見つけなさいよね！,好好觀察演唱會，下次一定要\n好好找出來哦！
0000000000000,咲季,ぬぐぅ～、わたしが一番\n聞きたくない台詞を的確にぃ……,唔唔～，確實說中了我最不想聽的話語……
0000000000000,咲季,わたし、その評価は嫌いよ。,我討厭這樣的評價。
0000000000000,咲季,完成度が高いって、つまり……\n成長の余地が少ないって意味だもの。,說完成度很高，也就是……\n意味著成長空間很少嘛。
0000000000000,{user},もちろん、嫌いなのは知っていますよ。,當然，我知道你討厭這個。
0000000000000,咲季,ふーん、わかっていてそう言うのね。\nこのわたしに。,嘻，知道還敢這麼說呢。\n對著我這個人。
0000000000000,{user},変えられない事実で……\nあなたの長所でもありますから。,這是無法改變的事實……\n也是你的長處之一。
0000000000000,咲季,余計なお世話。\n目をそらしたりしないわよ。,多管閒事。\n不要轉移視線。
0000000000000,咲季,ちゃんとみんなに見せてあげるわ。\n完成度の高いライブをね。,我會好好向大家展示。\n高完成度的演唱會呢。
info,adv_pstory_001_hski_after-audition-final-normal-03.txt,,
译者,gpt-3.5-turbo-0125,,