id,name,text,trans
0000000000000,清夏,やほやほー、Pっち♪\n今日はなんか嬉しそうだね？,嘿嘿，制作人♪\n今天看你挺开心的啊？
0000000000000,{user},分かりますか？\n良いニュースがあったんです。,你看出来了吗？\n有个好消息。
0000000000000,清夏,ふーん？　あ、もしかして、\nあたしの新しい仕事だったり～？,嗯？啊，难道是……\n我的新工作？
0000000000000,{user},まあ遠からず、というところですね。,也算差不多吧。
0000000000000,{user},ちょっと今から流す曲を\n聞いてみてください。,请听一下我现在要放的这首歌。
0000000000000,清夏,曲？　別にいーけど……,歌？没问题……
0000000000000,{user},どうでしたか？,觉得怎么样？
0000000000000,清夏,めっちゃ良い曲じゃん！\nノリやすいし、聞いててアガる～。,这首歌真不错！\n节奏感好，听着就有劲儿。
0000000000000,清夏,え、てかこれ誰の曲なん？\nフツーに買いたいんだけど。,诶，这是谁的歌？\n我都想买了。
0000000000000,{user},これは清夏さんの曲です。,这是清夏你的歌。
0000000000000,清夏,……え？　あたしの曲？,……啥？我的歌？
0000000000000,清夏,マジ！？　\n良いニュースってそゆこと！？,真的！？\n好消息就是这个！？
0000000000000,{user},はい。\n清夏さんのための曲ができました。,是的。\n专门为你做的歌。
0000000000000,清夏,わ、わ～……マジかぁ～……,哇，哇～……真的啊……
0000000000000,{user},聞いていると、自然と体が動いて\n踊ってしまうような曲です。,这是一首听着就会不自觉\n动起来跳舞的歌。
0000000000000,{user},清夏さんにぴったりじゃないですか？,很适合你，不是吗？
0000000000000,清夏,確かにそうかも！\nなんかイメージ湧いてきた！,确实是这样！\n我已经有画面感了！
0000000000000,清夏,ステージの上でこの曲を歌って、\nお客さんも一緒に踊ってもらうんだ。,在舞台上唱这首歌，\n让观众也一起跳。
0000000000000,{user},良いアイデアですね。\nそれも検討しましょう。,好主意。\n我们可以考虑一下。
0000000000000,清夏,へへっ♪\nなーんか楽しみになってきたねっ！,嘿嘿♪\n突然觉得好期待啊！
0000000000000,清夏,さっそく練習しよっ？\nあ、でも、まずは繰り返し聞きたいな。,马上开始练习吧？\n啊，不过，我先想多听几遍。
0000000000000,{user},ええ、どうぞ。\n飽きるまで聞いてください。,好的，请随意。\n听到不想听为止都行。
0000000000000,清夏,何度聞いても飽きないな～♪\nあたし、この曲好き～。,听多少遍都不腻啊～♪\n我喜欢这首歌。
0000000000000,{user},清夏さんのための曲ですからね。,毕竟是为你量身定做的。
0000000000000,清夏,曲調はアップテンポだけど、\nなんか、妙に共感できる歌詞だなー。,虽然曲调欢快，\n但歌词有种莫名的共鸣感。
0000000000000,清夏,なーんか、そこもあたしって感じ。\n見抜かれてるのかな……,这个感觉也挺像我的。\n是不是被看穿了……
0000000000000,{user},さあ、どうでしょう。,呵呵，谁知道呢。
0000000000000,清夏,Pっち、なんか助言とかしたの？,制作人，你有没有给过建议？
0000000000000,{user},プロデューサーですからね。\n少しは口を出します。,作为制作人嘛。\n多少还是会插嘴的。
0000000000000,清夏,だと思った……ま、いーけどね。\n気に入ったから。,我就知道……不过也没关系。\n我喜欢这首歌。
0000000000000,清夏,へへ、これがあたしの曲かぁ～。\nどう歌おっかな～。,嘿嘿，这是我的歌啊～。\n怎么唱好呢……
0000000000000,{user},曲も歌詞も、それを表現するのは\nアイドルである清夏さんです。,曲子和歌词，最终表现出来的\n是作为偶像的你。
0000000000000,{user},清夏さん次第で、曲の仕上がりが\n変わりますからね。,所以歌曲的完成效果\n全看你的发挥了。
0000000000000,清夏,Pっち、なかなかプレッシャー\nかけてくるじゃん……,制作人，你还挺会给压力的啊……
0000000000000,清夏,でも上等。テンション上がってきた。\n望むところって感じ？,不过没问题。这让我更有干劲了。\n期待吧？
0000000000000,{user},ではさっそく、振り付けの練習\nから始めていきましょうか。,那我们就从舞蹈练习\n开始吧。
0000000000000,清夏,ん、おっけー！,嗯，没问题！
0000000000000,清夏,任せてよ、Pっち。\nサイコーの曲にしてあげるから♪,交给我吧，制作人。\n我会让这首歌变得超棒的♪
info,adv_cidol-ssmk-3-000_01.txt,,
译者,gpt-4o-2024-05-13,,