id,name,text,trans
0000000000000,{user},（さて、咲季さんの様子は……）,（那么，咲季小姐的情况是……）
0000000000000,咲季,ふうっ……\n今日のレッスン終わりっ！,呼……\n今天的课程结束了！
0000000000000,咲季,あら、プロデューサー。\n見にきてくれたの？,啊，制作人。\n你来看我了？
0000000000000,{user},お疲れ様です。咲季さん、\n調子はいかがですか？,辛苦了，咲季小姐，\n你感觉怎么样？
0000000000000,咲季,すごーく悪いわっ！,非常糟糕！
0000000000000,咲季,先週の方が、ずっとよく動けてた。,上周的状态好多了。
select,,余裕がありますね,你看起来很轻松
select,,原因は\n明らかですね,原因很明显
select,,先週よりも\n可愛いですよ,比上周更可爱了
0000000000000,咲季,原因がはっきりしてるもの。,原因很清楚嘛。
0000000000000,咲季,動きが悪くなってるのは……\n体重を増やしたせいね。,动作变差了……\n是因为体重增加了。
0000000000000,咲季,新しい『アイドルとしての身体』を、\n使いこなせていないんだわ。,我还没能完全掌握\n新的“偶像体型”。
0000000000000,咲季,体重を維持しつつ、\n身体のキレを取り戻す。,在保持体重的同时，\n恢复身体的灵活性。
0000000000000,咲季,これが次の課題ねっ！,这是下一个课题！
0000000000000,{user},……これではプロデューサーの\n出る幕がありませんね。,……这样看来制作人也\n没什么用武之地了。
0000000000000,咲季,ひひー、落ち込まないの。\nそのうち頼らせてもらうわよ。,嘿嘿，别灰心。\n以后我会依赖你的。
0000000000000,咲季,うん、体重を増やしたせいよね。,嗯，确实是因为体重增加了。
0000000000000,咲季,全身にバランスよく、\nうっすらと脂肪を付けるイメージで――,想象一下，均匀地\n在全身上增加一点点脂肪——
0000000000000,咲季,格闘技に近い感じかなって\n思ってたんだけど……,有点像格斗技的感觉……
0000000000000,{user},今回は、少し筋肉量も\n減らすプランでしたね。,这次的计划是，稍微减少\n一些肌肉量。
0000000000000,咲季,色んな競技をやってきたけど……\nどれとも勝手が違ってて、苦戦中よ。,我尝试过很多运动项目……\n但这个完全不一样，真的很难。
0000000000000,咲季,身体作りができたとして……きっと\n維持するのも大変なのよね。,即使能塑造好身体……\n保持也一定很难。
0000000000000,咲季,改めて……アイドルってすごいわ。,再次感受到……偶像真的很了不起。
0000000000000,咲季,ん～っ、やる気出てきたぁ！,嗯～，干劲上来了！
0000000000000,咲季,そ、そうかしらっ？,真，真的吗？
0000000000000,{user},ぐっと柔らかい印象になりました。\nとても魅力的です。,整体感觉柔和了很多。\n非常有魅力。
0000000000000,咲季,えへへぇ……実はわたしも、\nそうじゃないかなーって思ってたの。,嘿嘿……其实我也觉得\n可能是这样。
0000000000000,{user},『アイドルとしての身体づくり』は、\n成功しています。あとは……,“作为偶像的身体塑造”\n已经成功了。接下来就是……
0000000000000,咲季,身体のキレを取り戻すだけね！,只要找回身体的灵活性！
0000000000000,咲季,う～ん、明確な課題があると楽しいわ！,嗯，有明确的课题真有趣！
0000000000000,咲季,プロデューサーも、そう思わない？,制作人，你不觉得吗？
info,adv_pstory_001_hski_after-step-2-normal-03.txt,,
译者,gpt-4o-2024-05-13,,