id,name,text,trans
0000000000000,咲季,にひー、佑芽！\n今回もわたしの勝ちよっ！,嘿嘿，佑芽！\n这次又是我赢了！
0000000000000,佑芽,むぅ～～～～～～～！　\n悔しい～～～～～～っ！,呜～～～～～～～！\n好不甘心～～～～～～！
0000000000000,咲季,前よりもずっと良くなってたわ。\n褒めてあげる。,比之前好多了。\n值得表扬哦。
0000000000000,咲季,だけど、そー簡単に\n勝たせてはあげないわよ。,但是，这么简单\n我可不会让你赢。
0000000000000,咲季,だってわたしは、お姉ちゃんだもの！,因为我是姐姐啊！
0000000000000,佑芽,ぬぐぐぅ……はぁ、\nやっぱりお姉ちゃんはすごいなぁ。,嗯……果然姐姐很厉害啊。
0000000000000,佑芽,次！　次こそ勝つからね！,下一次！下一次我一定会赢的！
0000000000000,咲季,ええ、頑張りなさい。期待してる。,嗯，加油哦。我很期待。
0000000000000,咲季,ふぅ～～～～～～～～～～っ。,呼～～～～～～～～～～～～。
0000000000000,{user},咲季さん、お疲れさまでした。,咲季，辛苦了。
0000000000000,咲季,プロデューサー……\nまぁ、見てのとおりよ。,制作人……\n你也看到了吧。
0000000000000,咲季,なんとか勝ったわ。,总算是赢了。
0000000000000,{user},予想以上でしたね。花海さんが\nあそこまで成長しているとは。,超出预期了呢。没想到花海\n能成长到这种程度。
0000000000000,咲季,あら、見る目ないのね。\nわたしの妹よ？,哦，是你眼光不行啦。\n她可是我妹哦？
0000000000000,{user},失礼、そうでしたね。しかし……,抱歉，是这样呢。不过……
0000000000000,{user},あの急成長の理由は、彼女本人が持つ\n大きな才能だけでは足りません。,她能有这么大的进步，不仅仅是\n因为她自身的天赋。
0000000000000,咲季,というと？,你是指？
0000000000000,{user},最高のお手本であり最高のサポーター\nでもある咲季さんが、そばにいたこと。,是因为有你这样优秀的榜样\n和支持者在她身旁。
0000000000000,{user},あなたこそが、花海さんを\n導き育てている。いまこのときも。,是你，一直在引导和培养花海，\n即使是现在也是。
0000000000000,咲季,えへへ……♡　そ、そかな……？,嘿嘿……♡ 是、是这样吗……？
0000000000000,{user},照れている場合ですか。敵ですよ。,现在不是害羞的时候哦。她可是对手。
0000000000000,咲季,そ～なのよねぇ～～～！\nどうしよプロデューサー！,对呀～～～！\n怎么办啊制作人！
0000000000000,咲季,わたしの敵が、\nどんどんどんどん成長してるぅ～～！,我的对手，\n正在不断不断地成长啊～～！
0000000000000,{user},そんな嬉しそうな顔で言われても……,你这么高兴的表情说这种话……
0000000000000,咲季,ん、わかってる。自分で蒔いた種\nだもの。ちゃんとわかってるわ。,嗯，我知道。这是我自己\n播下的种子。我很清楚。
0000000000000,咲季,入学試験首席のわたしが、\n井の中の蛙だったってこともね。,即使我是入学考试的第一名，\n也只是井底之蛙啊。
0000000000000,{user},内部進学組を含めても、咲季さんは\n1年生の中では上位です。,即便包括内部升学生，咲季你\n也是一年级中的佼佼者。
0000000000000,咲季,でも、一番じゃないわ。,但我不是第一。
0000000000000,咲季,上には上がいて……\n上を見上げればキリがない。,总有比我更强的……\n仰望上去没有尽头。
0000000000000,咲季,わたし、舐めてたわ。\nアイドルって……すごいのね。,我轻视了。\n偶像真是……太厉害了。
0000000000000,咲季,あー悔しいっ！,啊，好不甘心！
0000000000000,咲季,わたしはね、負けるのが大嫌い。\n妹以外にだって……負けたくない。,我真的讨厌输。\n不想输给任何人，包括妹妹。
0000000000000,咲季,なのに今この時も、ライバルたちに\n差をつけられている気がする。,可现在，我感觉我正被对手们\n甩在后面。
0000000000000,咲季,それが……すっっっっ……ごく、\n悔しくて、情けないの。,这让我……非常、非常地，\n不甘心，觉得自己很没用。
0000000000000,{user},咲季さんも、成長していますよ。,咲季，你也在不断成长。
0000000000000,咲季,足りないわ！　ちっとも足りない！,不够！一点也不够！
0000000000000,咲季,入学前から、\nアイドルとしての体作りをしてきた。,从入学前开始，\n我就一直在为成为偶像做准备。
0000000000000,咲季,入学時点で首席を取って……,入学时拿了第一名……
0000000000000,咲季,それから2ヶ月間、最高の環境で\n最高の練習をしてきたって信じてる。,这两个月来，我一直相信自己在最好的环境中\n进行了最好的训练。
0000000000000,咲季,なのに……\nわたしの成長は止まっちゃった。,可是……\n我的成长停滞了。
0000000000000,咲季,教えてプロデューサー……\nわたしには――なにが足りないの！？,告诉我，制作人……\n我到底缺少什么！？
0000000000000,{user},やっと頼ってくれましたね。\n……実は心配していたんです。,终于愿意依赖我了呢。\n……其实我一直很担心。
0000000000000,{user},さして役に立てていなかったので、\n信頼を失ってしまったのか、と。,因为我没什么用处，\n还以为失去了你的信任。
0000000000000,咲季,プロデューサーは\nよくやってくれているわ。,制作人你\n做得已经很好了。
0000000000000,咲季,すごく気が利くし、\nなんでも先回りしてやってくれるし。,你非常细心，\n总是提前为我安排好一切。
0000000000000,咲季,わたしが理想的な環境で\n過ごせているのは、あなたのおかげ。,我能够在理想的环境中\n生活都是因为你。
0000000000000,咲季,信頼なんてとっくにしてる。,信任你早就有了。
0000000000000,{user},…………褒めすぎでは。,…………有点过誉了吧。
0000000000000,咲季,きひひ、照れてるー。\nふふん、いつものお返しよ！,嘿嘿，害羞了吧。\n哼哼，这是我的回礼！
0000000000000,咲季,そういうわけだから。\n頼らせてもらうわ、プロデューサー。,所以呢。\n让我依赖你吧，制作人。
0000000000000,{user},喜んで。――咲季さんに足りないもの、\nでしたね。こう言い換えましょう。,乐意之至。――你缺少的东西，\n咲季小姐。让我换个说法。
0000000000000,{user},咲季さんにはなくて、\n花海さんにはあるもの。,咲季小姐没有的，\n花海小姐却有的东西。
0000000000000,咲季,…………それは？,…………那是什么？
0000000000000,{user},お姉ちゃんです。,是姐姐。
0000000000000,咲季,えっ……………わたし？,诶……………是我？
0000000000000,{user},先ほども言いましたが、咲季さんの\n存在が、花海さんを強くしている。,就像我刚才说的，咲季小姐的\n存在让花海小姐变得更强。
0000000000000,{user},頼れる身内で、有能な専属トレーナー\nで、格上のライバルで……,一个可以依靠的亲人，有能力的专属教练，\n还有高水平的对手……
0000000000000,咲季,ちょっとー\nくすぐったいんだけど……！,等等，这有点\n痒痒的……
0000000000000,{user},そんな最高のお姉ちゃんが常に、\n才ある妹のそばにいるのですから。,你这样最好的姐姐，\n一直在有才华的妹妹身边。
0000000000000,{user},無敵でしょう、それは。,这就是无敌的存在。
0000000000000,咲季,そ――そっ、そんなこと言われても！,这——这，这么说也没用啊！
0000000000000,咲季,わたしはふたりいないのよ！　\nどうしようもないじゃない！,我可没有两个自己啊！　\n这根本没办法解决！
0000000000000,{user},だからプロデューサーがいます。,所以才有制作人存在。
0000000000000,{user},用意してみせますよ。咲季さんを\n無敵にするために、必要なものを。,我会准备好一切。为了让咲季小姐\n变得无敌，所需要的东西。
0000000000000,咲季,……よくわかんないけど。\nこれからも、頼っていいってコト？,……虽然不太明白。\n但今后也可以依赖你吗？
select,,お姉ちゃんと\n呼んでください,叫我姐姐吧
select,,頼れる身内に\nなってみせます,我会成为你可以依靠的亲人
select,,ライバルには\nなれませんが,虽然成不了对手
0000000000000,咲季,呼ぶわけないでしょ！　ばかぁっ！,才不会叫呢！　笨蛋！
0000000000000,咲季,……はいはい。\nせいぜい頑張りなさい。,……好啦好啦。\n尽量加油吧。
0000000000000,咲季,………………もうなってるけどね。,………………其实已经在努力了。
0000000000000,咲季,当たり前でしょ！！,这不是理所当然的吗！！
0000000000000,{user},一度、レポートをまとめ直そう。,我们重新整理一下报告。
0000000000000,{user},咲季さんは着実に成長している……\n日々、最高の努力を続けている……,咲季小姐在稳步成长……\n每天都在做最好的努力……
0000000000000,{user},……早くなんとかしなくては。,……得赶快想办法才行。
info,adv_dear_hski_006.txt,,
译者,gpt-4o-2024-05-13,,