id,name,text,trans
0000000000000,あさり先生,篠澤さんの目下の課題は\n体力不足だと伺っています。,篠澤小姐目前的課題是\n聽說是體力不足。
0000000000000,広,そう、体力不足。,是啊，體力不足。
0000000000000,あさり先生,しかし体力がつくのを待っていたら\n卒業、なんてことになりかねません。,但是如果一直等到體力變好才行動的話，\n可能就會錯失畢業的機會了。
0000000000000,あさり先生,デビューを目指すなら、どうしても\nどこかで一歩踏み出す必要があります。,如果想要追求出道，就一定要\n在某個時刻踏出第一步。
0000000000000,あさり先生,そんなとき、体力不足を\nどうやって補えばいいと思いますか？,在這樣的時候，你覺得\n應該如何補充體力不足呢？
0000000000000,広,……プロデューサー。\nなにか考えてる？,……製作人。\n有什麼想法嗎？
0000000000000,{user},（なかなか痛いところをついてくる）,（確實觸及了痛處）
select,,体力のいらない\n仕事を,選擇不需要體力的\n工作
select,,実践で鍛える,實際行動鍛鍊
select,,体力不足を\nウリにする,將體力不足\n當作優勢
0000000000000,{user},選択肢は減りますが、現実的に\n考えるならこれでしょう。,選項雖然減少，但從實際出發的話，\n這應該是最好的選擇。
0000000000000,広,どういう仕事？,是什麼樣的工作？
0000000000000,{user},座って話したり、\nスポットでの出演だったり。,坐下來談話，\n或是臨場演出。
0000000000000,広,ふふ……耐えられるかな。,呵呵……能堅持下來嗎。
0000000000000,{user},その心配がなくなるくらいには\n鍛えてもらいますよ。,我會讓你鍛鍊到\n不再擔心這個的。
0000000000000,あさり先生,そうですね、現場を見極めるのも\nプロデューサーの仕事です。,是的，觀察現場也是\n製作人的工作。
0000000000000,あさり先生,新人では大変でしょうが、\nきっとうまくできますよ♪,對新人來說可能有點困難，\n但你一定能行的♪
0000000000000,{user},体力づくりのビジョンには\n実践での体力向上も含まれています。,在體力建設的願景中\n也包括實際行動提升體力。
0000000000000,{user},篠澤さんがやり遂げられるラインを\n見極めることに全力を注ぎます。,我將全力以赴來確定篠澤小姐\n可以達到的極限。
0000000000000,あさり先生,な、なかなか綱渡りですね……,真是走鋼索啊……
0000000000000,広,プロデューサーができると\n思うなら……,如果製作人認為可以的話……
0000000000000,広,文句、言わないよ。,我不會抱怨的。
0000000000000,あさり先生,なるほど。\n信頼関係の賜物、ですね。,原來如此。\n這是信賴關係的恩惠啊。
0000000000000,{user},みんなが踊っているなか、\n棒立ちというのもネタになります。,在大家都在跳舞時，\n站著一動不動也能成為話題。
0000000000000,{user},もちろんそれでは長続きしないので、\n一時しのぎですが。,當然這樣做不會持久，\n只是暫時應急而已。
0000000000000,広,プロデューサー、いろんなこと\n考えてるんだね。,製作人，考慮了很多事情呢。
0000000000000,広,そんなの、思いつかなかった。,我沒想到會有這樣的想法。
0000000000000,{user},考えるのがプロデューサーの\n仕事ですから。,考慮事情是\n製作人的工作啊。
0000000000000,あさり先生,棒立ちは確かにかなり変わった\nアイデアかもしれませんが……,站著不動確實是相當奇特的\n點子……
0000000000000,あさり先生,いろんな案を持ってるのは、\n敏腕の証、ですね♪,擁有各種想法，\n這是高手的證明哦♪
info,adv_pevent_001_shro_school_003.txt,,
译者,gpt-3.5-turbo-0125,,