id,name,text,trans
0000000000000,あさり先生,今日はせっかくふたりなので……\n花海さん、困ってることありますか？,今天既然有兩個人在一起呢……\n花海，有什麼困擾嗎？
0000000000000,咲季,困ってること？　筋肉痛が長引いてて\nトレーニングができない……,困擾嗎？因為肌肉痠痛一直持續\n無法進行訓練……
0000000000000,咲季,って、こんなのじゃなくて\nアイドルとしてですよね。,不過，這不是說\n關於偶像的事情嗎。
0000000000000,あさり先生,いえいえ、そんな困り事も\nプロデューサーとして見事解決！,沒事沒事，像這樣的困難\n製作人一定能巧妙解決！
0000000000000,あさり先生,ですよね？\n{user}くん♪,對吧？<br{user}君♪
0000000000000,{user},（これは俗にいう無茶振りでは……）,（這可說是所謂的難題了……）
select,,マッサージの\n勉強をします,我要去\n學習按摩
select,,脳を鍛えましょう,鍛鍊大腦
select,,自分がトレー\nニングします,進行自己的\n訓練
0000000000000,咲季,だめよっ。マッサージは筋肉痛に\nなる前にしないと！,不行哦。按摩要在肌肉痠痛之前\n進行才對！
0000000000000,{user},ですから、次にこんな状況になった\nときのために。,所以，為了下次遇到這樣的情況。
0000000000000,咲季,それ、今からわたしに教わって\nおきたいってこと？\n,這是說現在就要我學會\n嗎？\n
0000000000000,あさり先生,将来を予測して対策を練るのは\n大事ですよー。,預測未來並制定對策\n是很重要的喲。
0000000000000,あさり先生,いざというときのために、\n準備しておきましょう♪,為了緊急情況，\n提前做好準備♪
0000000000000,咲季,ええ？　どういうこと？,欸？　什麼意思？
0000000000000,{user},体と頭を区別するから困るんです。,因為區分身體和頭腦感到困擾。
0000000000000,{user},頭のトレーニングで満足できるように\nなれば、解決です。,如果能滿足頭腦訓練，\n問題就解決了。
0000000000000,咲季,先生～っ。,老師～。
0000000000000,あさり先生,発想の転換は大事ですよ～。\n試しにやってみましょう♪,轉變思維很重要哦～。\n試著做看看♪
0000000000000,咲季,ほ、本気……？,這、這是認真的……？
0000000000000,咲季,なんでよっ！,為什麼啊！
0000000000000,{user},咲季さんに指導してもらいます。\nそれで気を紛らわせましょう。,咲季要來指導。\n這樣就能轉移注意力。
0000000000000,あさり先生,教えることでトレーニングへの理解も\n深まりますし……,透過教學，對訓練的理解也會更深入……
0000000000000,あさり先生,それで気分が落ち着くなら、\n意外と最適かもしれませんね♪,如果這樣能讓你心情平靜，\n也許意外地很適合呢♪
0000000000000,咲季,じゃあ、これが終わったら\nトレーニングルームね……,那麼，做完這個之後\n就去訓練室吧……
0000000000000,咲季,体にとっても効く科学的な追い込み\nってやつをしてあげる♪　フフフ……,為身體帶來好處的科學訓練\n我會給你做♪ 噗噗噗……
info,adv_pevent_001_hski_school_002.txt,,
译者,gpt-3.5-turbo-0125,,