id,name,text,trans
0000000000000,佑芽,プロデューサーさん！,製作人！
0000000000000,佑芽,ついにこの日が\nやってきましたね！,終於來到這一天了！
0000000000000,{user},いつにも増して\nはりきっていますね、佑芽さん。,佑芽，今天的狀態好像比平常更有幹勁呢。
0000000000000,佑芽,はいっ！　だって……見ましたか？　\n参加者たちの顔を。,是的！因為……你看到了嗎？參賽者們的表情。
0000000000000,佑芽,みんな、ものすっごい気合ですよ！\nこっちも負けていられませんっ！,大家都充滿了超強的戰意！我們也不能示弱！
0000000000000,{user},それはそうでしょうね。\nなんといっても……,確實是這樣呢。畢竟……
0000000000000,{user},今日は『<r\=セレクション>選抜試験</r>』ですから。,今天是『選拔試驗』的日子。
0000000000000,佑芽,それってなんでしたっけ？,這是什麼來著？
0000000000000,{user},夏に行われる大イベントへの\n参加権を得るための――,為了獲得夏季大活動的參加資格而進行的――
0000000000000,{user},<r\=ライブ>実践</r>形式の<r\=オーディション>試験</r>になります。,採用<r\=演唱>實踐</r>形式的<r\=試験>。
0000000000000,佑芽,むむっ……聞いたことが\nあるような気がしますよ！,嗯嗯……好像聽過類似的內容！
0000000000000,佑芽,そう、確か――,對了，沒錯――
0000000000000,佑芽,『Hatsuboshi IDOL FESTIVAL』！！,『Hatsuboshi IDOL FESTIVAL』！！
0000000000000,{user},その通り。学園一の\nアイドルを決める祭典です。,就是這樣。是決定學園第一偶像的祭典。
0000000000000,{user},咲季さんとの決戦の場として、\n最高の舞台だと思いませんか？,作為與咲季的決戰場所，你不認為這是最棒的舞台嗎？
0000000000000,佑芽,……プロデューサーさん。,……製作人。
0000000000000,佑芽,――はい！　思います！,――對！我覺得！
0000000000000,佑芽,重要なオーディション――……\n試験だったんですね、今日って。,這是一個重要的試驗呢，今天是試驗的日子。
0000000000000,佑芽,お姉ちゃんとの勝負じゃないんだって、\n残念に思っていたんですけど。,原來不是和姊姊比賽，我還有點失望呢。
0000000000000,佑芽,こんなの……\n絶対負けられないじゃないですか！,但這樣的考驗……絕對不能輸！
0000000000000,佑芽,たとえあたしが、\n補欠入学の劣等生でも……,就算我是補充入學的劣等生……
0000000000000,佑芽,参加者が全員格上のアイドルでも……,就算參賽者都是高手偶像……
0000000000000,佑芽,そんなの関係ありません！,都沒關係！
0000000000000,佑芽,よぉ～～～～～っし、\n一番になってきます！,來吧～～～～～～，我會成為第一名的！
0000000000000,{user},（ライブが終わるや否や、\nステージに大歓声が降り注いだ）,（演唱結束後，台上響起了熱烈的掌聲）
0000000000000,佑芽,みなさぁーーーーん！　\nありがとうございましたぁ！,各位～～～～～～，謝謝大家！
0000000000000,{user},お疲れ様でした、佑芽さん。\n圧倒的なパフォーマンスでしたね。,辛苦了，佑芽。表現得非常震撼呢。
0000000000000,{user},ここまでの参加者の中では、\n一番です。,在所有參賽者中，你是第一名。
0000000000000,佑芽,はいっ！　あたしやりました、\nプロデューサーさん！,是的！我做到了，製作人！
0000000000000,佑芽,――って、あたし、\n一番になったんですよ！,――對了，我成為了第一名！
0000000000000,佑芽,あのっ、格上オーラをビシバシ出してた\n人たち全員に勝ってきたんですよ！,那些散發著高手氣場的人們，我都戰勝了！
0000000000000,{user},そうですね。,沒錯。
0000000000000,佑芽,ちっとも驚いてないじゃないですか！？,你怎麼一點都不驚訝的！？
0000000000000,{user},勝つと信じていましたから。\nあらかじめ、伝えてあったはずです。,因為我相信你會贏。我之前已經告訴過你了。
0000000000000,{user},花海佑芽は、いままさに、\nブレイクスルーを果たしつつあると。,花海佑芽，現在正在取得突破。
0000000000000,佑芽,………あたし、\nすごく……成長してる？,………我，有很大的進步嗎？
0000000000000,{user},でなければ、\n今日のような結果にはならない。,否則，今天的結果就不會是這樣了。
0000000000000,{user},さて、信じてくれましたか？\nいまの自分の力を。,那麼，你相信自己的力量了嗎？
0000000000000,佑芽,でも、あたし、まだまだ\nお姉ちゃんには――――,但是，我還是和姊姊比起來――――
0000000000000,{user},いまだけでいい。花海咲季を\n基準にするのはやめましょう。,現在只考慮當下就好。不要以花海咲季為標準。
0000000000000,咲季,プロデューサーの言うとおりよ。,製作人說得沒錯。
0000000000000,佑芽,お、お姉ちゃん！？,哦、姊姊！？
0000000000000,咲季,何度も言わせないでくれる？　\n佑芽は、とっても成長してるわ。,不要讓我重複說多次了啦？\n佑芽，真的長大了呢。
0000000000000,咲季,自分の力量ぐらい、\nちゃんと把握しておきなさい。,應該要好好掌握自己的實力哦。
0000000000000,咲季,でなきゃ――\n今日戦った相手に失礼でしょ？,否則──\n對今天戰鬥的對手太失禮了吧？
0000000000000,佑芽,…………………………,…………………………
0000000000000,佑芽,うん……だよね！,嗯……對呢！
0000000000000,佑芽,わかったよ、\nお姉ちゃん……プロデューサーさん！,知道了，\n姊姊……製作人！
0000000000000,佑芽,あたし……強くなってる！！,我……變得更強了！！
0000000000000,咲季,そう、それでいいわ。\nま、もっとも――,對，這樣就好。\n嘛，不過──
0000000000000,咲季,まだまだ、\nこのわたしには及ばないけどねっ♪,還差得遠呢，\n比不上我啦♪
0000000000000,佑芽,む～……お姉ちゃんは、\n『<r\=セレクション>選抜試験</r>』受けたの？,嗯～……姊姊，\n你參加『選拔試験』了嗎？
0000000000000,咲季,そういうの、愚問って言うのよ。\n――そろそろ出番ね。,這種問題就叫做愚問啦。\n──該上場了。
0000000000000,咲季,見てなさい、佑芽。\nあなたが目指す、わたしのライブを！,看著吧，佑芽。\n你所追求的，就是我演唱會的！
0000000000000,佑芽,やっぱり……お姉ちゃんは凄いなぁ。\n今日もあたしの――,果然……姊姊好厲害啊。\n今天又是我──
0000000000000,佑芽,負け！　とは！　言いませんけど！,輸了！　不！　才沒有輸！
0000000000000,佑芽,プロデューサーさん。,製作人。
0000000000000,佑芽,以前、あたしに聞きましたよね？\nアイドルへの情熱があるのかって。,之前問過我了對吧？\n對於成為偶像的熱情。
0000000000000,佑芽,あの時は、わからなかったこと。,那時候，我不知道。
0000000000000,佑芽,いまは、ちゃんと答えられます。,現在，我可以好好回答了。
0000000000000,佑芽,あたし――,我──
0000000000000,佑芽,アイドルとして\nあの人に勝ちたいです！,作為一名偶像\n想要戰勝那個人！
0000000000000,佑芽,他の競技じゃダメなんです。\nあたしはお姉ちゃんに勝って、,其他競技都不行。\n我要比姊姊厲害，
0000000000000,佑芽,世界で一番のアイドルになります！,成為世界上最棒的偶像！
0000000000000,佑芽,あれから、何度も何度も考えました。\n視野が狭いのかもって、悩みました。,從那之後，我想了好多好多次。\n是不是視野太狹窄了呢，困擾了我。
0000000000000,佑芽,だけど、何度考えても、\nどんなアイドルを映像で観ても……,但無論想了多少次，\n看了多少其他偶像的影片……
0000000000000,佑芽,答えは変わらないんです。,答案都沒變。
0000000000000,佑芽,あたしにとって、世界で一番の\nアイドルはお姉ちゃんなんです。,對我來說，世界上最棒的\n偶像就是姊姊。
0000000000000,佑芽,お姉ちゃんに勝てば、\nそれが世界一なんです。,如果能戰勝姊姊，\n那就是世界第一了。
0000000000000,佑芽,プロデューサーさんは、それじゃ\nダメだって言うと思います……けど。,製作人可能會覺得\n這樣不行……但。
0000000000000,佑芽,誰にも文句は言わせません！\n勝った後のことなんて知りません！,我不會向任何人抱怨！\n贏了之後的事情我不知道！
0000000000000,佑芽,そんなの、お姉ちゃんに勝った後の\n新しいあたしに任せます！,那種事，交給\n打敗姊姊後的新的我吧！
0000000000000,佑芽,どうですか！　まいりましたか！　\nプロデューサーさん！,怎麼樣！　投降了嗎！\n製作人！
select,,いいと思いますよ,我認為沒問題
0000000000000,佑芽,えっ？？？？　いいんですか？？？,咦？？？？　可以嗎？？？
0000000000000,佑芽,前はダメって言ったのに？？？,之前不是說不行嗎？？？
0000000000000,{user},以前の答えとは、同じようで、\n違いますから。では佑芽さん――,和之前的回答，\n有所不同哦。那麼佑芽小姐──
0000000000000,{user},――それでいきましょう。,──就這樣吧。
0000000000000,佑芽,はいっ！,好的！
0000000000000,佑芽,今後ともよろしくお願いします、\nプロデューサーさん！,今後也請多指教，\n製作人！
0000000000000,{user},今日のプロデュース状況を\nメモしておこう。,記錄一下今天的培育狀況吧。
0000000000000,{user},目標が定まった。\nここからもっと伸びるぞ！,目標確定了。\n從這裡要更上一層樓！
info,adv_dear_hume_006.txt,,
译者,gpt-3.5-turbo-0125,,