id,name,text,trans
0000000000000,佑芽,うぅ～～～、今日も負けたぁ！\n悔しい～～～～～～～～ッ！,呜～～～，今天又输了！\n好不甘心～～～～～～～～！
0000000000000,{user},お疲れ様でした、佑芽さん。\nそれと、咲季さん。,辛苦了，佑芽。\n还有，咲季。
0000000000000,佑芽,あっ、プロデューサーさん！　\nいらしていたんですね！,啊，制作人！\n您来了啊！
0000000000000,{user},たったいま来たところです。\nおふたりで、いったいなにを？,我刚到。\n你们俩在干什么呢？
0000000000000,咲季,今日からレッスン室を\n借りられるというから――,因为从今天开始可以借用\n练习室了——
0000000000000,佑芽,さっそく勝負してたんです。\n負けちゃいましたけど！,所以马上就来比试了。\n虽然我输了！
0000000000000,咲季,思い知ったかしら、\nアイドルとしての力の差を。,感受到了吗，作为偶像\n的实力差距。
0000000000000,佑芽,ぐぬぬぅ～、お姉ちゃんめぇ。\n勝ち誇りやがってぇ～～～！,咬咬咬，姐姐你！\n太得意了吧～～～！
0000000000000,佑芽,そのうち絶対追いついて、\nあたしが勝つんだからぁ！,总有一天我一定会追上你，\n然后赢过你！
0000000000000,咲季,ふふふっ――その意気、その意気。\n頑張りなさい、佑芽。,呵呵呵——这志气不错。\n加油吧，佑芽。
0000000000000,佑芽,むぅぅ…………,唔唔…………
0000000000000,咲季,さて、妹が可愛く黙っちゃった\nところで。――プロデューサー。,好了，妹妹乖乖闭嘴了\n那就——制作人。
0000000000000,咲季,この前、聞きそびれた話の続きよ。,上次没来得及问的事情。
0000000000000,{user},佑芽さんのプロデュース<r\=プラン>計画</r>に\nついてですね。,是关于佑芽的培育计划\n的事情吧。
0000000000000,咲季,そうそう。\n見せてもらったあの資料ってさ。,对对。\n给我看的那些资料啊。
0000000000000,咲季,結局、うちの両親の\n意見が入っているってことなの？,最后还是包含了\n我们父母的意见吧？
0000000000000,{user},トレーナーと作成した計画書を、\nご両親に見ていただいたんですが。,我们把和教练一起制定的计划书，\n给您父母看了。
0000000000000,{user},……その場で娘の育成方針について\n激論が始まりまして……,……然后他们当场就开始\n激烈讨论起女儿的培养方针……
0000000000000,佑芽,うわ……現場にいなくても夫婦喧嘩の\n光景が見える見える……,哇……虽然我不在现场，\n但已经能脑补出夫妻吵架的画面了……
0000000000000,咲季,迷惑を掛けたみたいね。\n……親ばかなのよ、あの人たち。,看来给你们添麻烦了。\n……他们就是这么护女儿。
0000000000000,{user},いいえ、元プロアスリートとの\n貴重な意見交換の場でした。,不，这是一场和前职业运动员\n宝贵的意见交流。
0000000000000,{user},かなり計画をブラッシュアップ\nできたと思いますよ。,我觉得计划得到了很多\n改进提升。
0000000000000,咲季,へえ、それはいいわね。\nうん……面白くなってきた。,哦，那挺好的。\n嗯……事情变得有趣了。
0000000000000,咲季,いーい？　プロデューサー？,听好了，制作人？
0000000000000,咲季,渾身のプランで\n佑芽を鍛え上げなさい！,要用尽全力的计划\n来锻炼佑芽！
0000000000000,咲季,そうじゃなきゃ、\nわたしの相手にはならないわ！,否则的话，\n可比不上我！
0000000000000,佑芽,……あの、プロデューサーさん。,……那个，制作人。
0000000000000,{user},どうしました？,怎么了？
0000000000000,佑芽,ごめんなさい……あたし……\n負けちゃって。,对不起……我……\n输了。
0000000000000,{user},佑芽さん。プロデュースの\n初期段階で特に重要なのは……,佑芽。培育\n初期阶段最重要的是……
0000000000000,{user},担当アイドルを少しでも早く\n少しでも深く知ることだと思うんです。,尽快尽深地了解\n你所负责的偶像。
0000000000000,佑芽,な、なんの話ですか？,这是什么意思？
0000000000000,{user},この数日で、大きな成果があった、\nということですよ。,这几天，我们取得了很大成果，\n就是这个意思。
0000000000000,佑芽,あたしのことを……\n知ることができたから？,因为了解了……\n我的事情？
0000000000000,{user},はい。なにも問題はない。順調です。,是的。没有任何问题。很顺利。
0000000000000,佑芽,あたしと……お姉ちゃんを……\nそんなにたくさん調べたなら……,如果你了解了我和……\n姐姐的那么多事情……
0000000000000,佑芽,――後悔してませんか？,——你会不会后悔？
0000000000000,佑芽,お姉ちゃんの方がよかった、って。,觉得还是姐姐更好。
select,,確かに……,确实……
select,,まったく後悔など\nしていません,我完全没有\n后悔
0000000000000,{user},咲季さんと先に出会っていたら、\n違う選択をしていたかもしれません。,如果我先遇到咲季，\n可能会做出不同的选择。
0000000000000,佑芽,うぅ～、やっぱりぃ～～～！,呜～，果然～～～！
0000000000000,{user},ですが、後悔はしていませんよ。\nむしろ逆です。まったくの、逆。,但是，我并不后悔。\n相反，完全相反。
0000000000000,佑芽,……本当、ですか？,……真的吗？
0000000000000,{user},内心、笑いが止まらないくらいには、\n本当です。,内心笑得停不下来，\n是真的。
0000000000000,佑芽,な、なんですかぁ、それ……,什，什么啊，那是……
0000000000000,{user},あなたには……咲季さんに負けない\n巨大な潜在能力が秘められている。,你有……不输给咲季的\n巨大的潜力。
0000000000000,佑芽,ええ～～っ！？　\nそっ、そうだったのかぁ……！,哎～～！？\n原，原来如此啊……！
0000000000000,{user},1つはその単じゅ……素直さですが。\nもっとも大きな才能は精神ではなく。,一方面是你的单纯……率直。\n但更大的才华不在于精神。
0000000000000,{user},アイドルとして\n最高の数値を持つ肉体です。,而是作为偶像\n拥有最高数值的身体。
0000000000000,佑芽,それって……,那是……
0000000000000,佑芽,え、えっちですよ！　\nプロデューサーさん！？,你，这很色情啊！\n制作人！？
0000000000000,{user},無尽蔵の体力、比類なき柔軟性、\n強靭な筋肉、莫大な肺活量……等々。,无尽的体力，无比的柔韧性，\n强壮的肌肉，巨大的肺活量……等等。
0000000000000,佑芽,……あっ、そ、そういう意味……\nモチロンわかってましたよ？？？,……啊，是，这样的意思……\n当然我明白？？？
0000000000000,{user},佑芽さんは、数値化できる能力が\n軒並み高いんです。それは……,佑芽，你的量化能力\n都非常高。这是……
0000000000000,{user},トップアイドルになるための\n堅固な土台に他ならない。,成为顶级偶像的\n坚实基础。
0000000000000,佑芽,えへへ……たくさん鍛えましたから！\nでも、レッスンでは怒られてばかりで。,嘿嘿……因为我锻炼了很多！\n不过，训练时总是被骂。
0000000000000,{user},ご両親からもうかがっています。\n佑芽さんはスロースターターだと。,你的父母也告诉我了。\n佑芽是慢热型。
0000000000000,{user},とてつもなく覚えが悪くて、\nいつも不安だと。,记忆力极差，\n总是让人担心。
0000000000000,佑芽,ぐぬぬ……\nそれ言ったの、絶対お父さんですね！,呃……\n这绝对是爸爸说的！
0000000000000,{user},そんなあなたの覚醒を早めるのが、\nプロデューサーの役目です。俺に――,加速你的觉醒，\n是制作人的职责。让我——
0000000000000,{user},最高の肉体を持つトップアイドルを、\n育てさせてくれませんか。,让我培育出拥有最佳体质的顶级偶像吧。
0000000000000,佑芽,あはは……やっぱりちょっと、\nえっちな意味に聞こえるなぁ……,哈哈……还是有点\n色的感觉啊……
0000000000000,佑芽,あの、プロデューサーさん。,那个，制作人。
0000000000000,佑芽,いまのあたしは……\nお姉ちゃんの足元にも及びません。,现在的我……\n还比不上姐姐。
0000000000000,佑芽,調べたなら、わかっているはずです。\nあたしの敵は、強すぎるって。,如果你调查过，应该知道。\n我的对手太强了。
0000000000000,佑芽,勝ち目はないかもしれないって。\nそれでも――――,可能没有胜算。\n即便如此——
0000000000000,{user},勝つつもりでいます。\nあなたと同じように。,我有必胜的决心。\n和你一样。
0000000000000,{user},それを、今後のプロデュースで\n証明してみせますよ。,我会在今后的培育中\n证明这一点。
0000000000000,佑芽,…………もう、とっくに信じてますよ。,…………我早就相信了。
0000000000000,佑芽,こんなあたしに……\n補欠入学の劣等生に……,对这样一个我……\n补录入学的劣等生……
0000000000000,佑芽,そこまで言ってくれて……,你能这么说……
0000000000000,佑芽,出会ってから間もないのに……\nすぐに色々やってくれて……,虽然我们才刚刚认识……\n你已经做了很多……
0000000000000,佑芽,そんな人、絶対他にはいません。\nプロデューサーさんだけです。,这样的制作人\n只有你。
0000000000000,佑芽,やりましょう！　一緒に、\nお姉ちゃんやっつけましょう！,一起干吧！\n把姐姐打败！
0000000000000,佑芽,一番下から大急ぎで駆け上って、\n最強のアイドルをぶっとばすんです！,从最底层快速爬上去，\n把最强的偶像打倒！
0000000000000,佑芽,そしたらきっと――\n人生最高にすかっとしますよ！,那样的话——\n人生会变得超级畅快！
0000000000000,{user},今日のプロデュース状況を\nメモしておこう。,记录下今天的培育情况。
0000000000000,{user},今は及ばずとも、必ず追いつける。\n……今から楽しみだ。,即使现在还不如她，终会赶上。\n……我已经迫不及待了。
info,adv_dear_hume_003.txt,,
译者,gpt-4o-2024-05-13,,