id,name,text,trans
0000000000000,ことね,さっそく教えてください、\nプロデューサー！,快告訴我，製作人！
0000000000000,ことね,あたしがもっとファンを\n楽しませるために――,為了讓更多粉絲\n享受樂趣——
0000000000000,ことね,どうしたらいいのかっ！,該怎麼辦才好呢！
0000000000000,{user},まず……大前提として。\n昨日のライブは成功でした。,首先……作為基本前提。\n昨天的演唱會非常成功。
0000000000000,ことね,えっ？,欸？
0000000000000,{user},喜んでいるファンは大勢いますし――\n新しく藤田ことねというアイドルを,有很多粉絲感到高興——\n對新成為藤田琴音的偶像
0000000000000,{user},好きになってくれた方だって、\nたくさんいると思いますよ。,產生好感的人，\n應該也有很多吧。
0000000000000,ことね,えっ、えっ？　でも……,欸、欸？ 但是……
0000000000000,{user},自分で言っていたではないですか。\n好評で嬉しかったと。,你自己不是說過嗎。\n因好評而感到高興。
0000000000000,{user},改めて、素晴らしいライブでした。\nよくがんばりましたね。,再次，表現得很棒。\n你真的很努力了呢。
0000000000000,ことね,……え、へへ……いやぁ～。実は自分\nでも……上手く踊れたかなって。,……欸、呵呵……其實我自己\n也不知道我有沒有跳得好。
0000000000000,ことね,だからこそ！　ダメ出しが\n気になっちゃったんですよぉ！,所以！批評就讓我\n很在意啦！
0000000000000,ことね,いまあたし、\nあれ以上のライブできないのに～～！,現在的我，\n已經無法再有更好的演出了～～！
0000000000000,{user},藤田さん、確認です。,藤田小姐，核對一下。
0000000000000,{user},良いライブができたことを\nちゃんと喜びましたか？,你有好好地為成功的演唱會\n感到高興嗎？
0000000000000,ことね,はいっ！　ファンの人たちや\nプロデューサーに、,是的！對於粉絲們和\n製作人們，
0000000000000,ことね,たくさん褒めてもらえて、\nテンションぐーんとアップ中ですッ！,能夠得到很多讚美，\n我的情緒正飆升中！
0000000000000,{user},よろしい。それでは、\n反省タイムに移りましょう。,很好。那麼，\n我們來進入反省的時間。
0000000000000,ことね,お願いしまっす！,拜託了！
0000000000000,{user},来場者の感想は、現在ネット上に\nアップされているものに加え、,來自觀眾的評價，不僅包括網路上\n已經發布的，
0000000000000,{user},会場内でのリサーチなどなど……\nすでに調査済みです。,也包括會場內的調查等等……\n我們已經做了調查。
0000000000000,ことね,でましたね！　恒例のやつが……！,又是例行公事呢……！
0000000000000,{user},それがプロデューサーの仕事です。\nよって……,這就是製作人的工作。\n因此……
0000000000000,{user},藤田さんに頼まれずとも、\nこちらで対策を立てるつもりでした。,即使沒有請求藤田小姐，\n我們也打算制定對策。
0000000000000,ことね,ひゅー、頼れるぅ～♪　\n……でっ、調査結果は？,呼，真是可靠～♪\n……那，調查結果呢？
0000000000000,{user},否定的な意見で多かったのは、\n歌がイマイチだったと。,負面意見主要集中在，\n覺得歌唱表現一般。
0000000000000,ことね,あっはい。,啊哈。
0000000000000,{user},しかしこの調査結果は、\n鵜吞みにできません。,但這份調查結果並不是\n可以全盤接受的。
0000000000000,ことね,と、いいますと？,這是指……？
0000000000000,{user},藤田ことねのファンなら、そんなことは\n承知の上で来ているはず。,藤田琴音的粉絲們，應該是有意識到\n這點才來到現場的。
0000000000000,ことね,ちょぉい！　もぉ～！,好啦！真是的！
0000000000000,ことね,で！　承知の上で来ているはずなら、\nどーだってゆーんですぅ？,那麼！如果粉絲們有意識到這一點，\n那又怎麼樣？
0000000000000,{user},ファンの方々は、感想をそのまま\n口にしないことがあります。,粉絲們有時候不會直接\n表達他們的感想。
0000000000000,ことね,それは……わかるかもです。あたしも、\n先輩のライブの感想とか書くとき……,這……我能理解。我寫前輩的演唱會感想時……
0000000000000,ことね,本音とちょっと違うけど、わかりやすい\nように書いトコ～って、やりますし。,雖然和真實想法有點出入，但為了讓\n讀者更容易理解，我也會這樣做。
0000000000000,{user},なんとか本音を知りたかったので、\n一人ひとり、調べられるだけ\n調べました。,為了了解他們的真實想法，\n我盡可能地一一調查了。
0000000000000,ことね,すぐそういうコトしますよね。\n……その結果は？,你很快就會這樣做呢。\n……結果呢？
0000000000000,{user},彼らの不満は、期待したものが\n得られなかったことにあるようです。,他們的不滿似乎來自，期待的東西\n沒有得到。
0000000000000,ことね,あたしのファンが、\nあたしに期待していたもの……？,我的粉絲們，期待著我……？
0000000000000,ことね,いままでのライブにはあって、\n昨日のライブにはなかったもの……？,以前的演唱會有的，\n昨天的演唱會沒有的……？
0000000000000,{user},答えにたどり着いたようですね。,看來你找到了答案。
0000000000000,ことね,や、わかんないですよ！\nでも……答えは言わないでください。,啊，我不知道啦！\n但……請不要說出答案。
0000000000000,ことね,もうすこしで、なにか――\nつかめそうなのでッ！,再過一點，就快要掌握什麼了！
info,adv_cidol-fktn-3-001_02.txt,,
译者,gpt-3.5-turbo-0125,,