id,name,text,trans
0000000000000,あさり先生,コアコンピタンスという言葉を\n知ってますか？,你知道「核心能力」這個詞嗎？
0000000000000,佑芽,知りませんっ！,不知道！
0000000000000,あさり先生,他人には真似できない\n優れた点のことです。,指的是其他人無法模仿的\n優秀之處。
0000000000000,あさり先生,アイドルにとっても、自分だけの\n魅力は強力な武器になります。,對於偶像來說，擁有自己獨特的\n魅力是一種強大武器。
0000000000000,あさり先生,今日は花海さんの魅力について、\n話し合ってみましょう。,今天讓我們來討論一下花海小姐的魅力。
0000000000000,佑芽,あたしのコアコン……,我的核心能力……
0000000000000,佑芽,プロデューサーさん！\n教えてくださいっ！,製作人！\n請教一下！
select,,行動力,行動力
select,,のびしろ,潛力
select,,オーラ,氣場
0000000000000,{user},考える前に動けるのは\n魅力の1つですね。,在思考之前就能行動，\n這也是魅力之一啊。
0000000000000,{user},考え込んでしまい、挑戦する前から\nチャンスを逃してしまう……,一旦陷入沉思，還未挑戰就錯失機會……
0000000000000,{user},佑芽さんには、そういったことが\n起き得ないということですから。,對佑芽來說，這種事情是\n不太可能發生的。
0000000000000,佑芽,よくわかんないですけど、\n今のままでいいってことですね！？,雖然有點不太懂，\n但是這樣下去就好了對吧！？
0000000000000,あさり先生,行動力があったおかげで、\nプロデューサーも付きましたしね。,有行動力的她，\n也因此吸引到了製作人。
0000000000000,あさり先生,いろんなことにチャレンジ\nしていってください♪,接受各種挑戰，\n加油哦♪
0000000000000,{user},佑芽さんにはとてつもない\nのびしろがあります。,佑芽有著非常大的\n潛力。
0000000000000,{user},それを完走できる根性とやる気も。\n将来が楽しみですね。,還有能夠堅持到底的毅力和幹勁。\n未來值得期待呢。
0000000000000,佑芽,あたし、自分ののびしろが\nどのくらいかわかりませんけど……,不知道自己的潛力\n有多少呢……
0000000000000,佑芽,プロデューサーさんが言うなら、\nそうだと思いますっ！,如果是製作人這樣說的話，\n我就相信了！
0000000000000,あさり先生,アイドルがどう成長するか\n注目するファンもいますからね。,有些粉絲關注著偶像\n成長的過程呢。
0000000000000,あさり先生,花海さんなら、がっちりと\n心を捕まえられると思いますよ♪,我想花海小姐能夠牢牢\n抓住他們的心♪
0000000000000,{user},言葉にするのは難しいですが、\n佑芽さんにはオーラがあります。,雖然難以用言語表達，\n但佑芽身上確實有一股氣場。
0000000000000,{user},この子がトップアイドルに\nならないのはおかしい。,這個孩子如果成為頂尖偶像\n才對啊。
0000000000000,{user},不思議とそんな気持ちに\nなってしまいますね。,不知怎麼回事，就是感覺\n是這樣的。
0000000000000,佑芽,それって、褒めてくれてるって\nことでいいんでしょうかっ！,這樣一來，就可以當作\n在讚美我對吧！
0000000000000,あさり先生,理屈でははかりきれないのが\nアイドルですからね。,偶像就是無法用理性來\n評價的。
0000000000000,あさり先生,そのオーラ、どう輝かせるかは\nきみたち次第です。,那種氣場，如何展現出來\n就取決於你們了。
0000000000000,あさり先生,頑張ってくださいね♪,請加油哦♪
info,adv_pevent_001_hume_school_003.txt,,
译者,gpt-3.5-turbo-0125,,