id,name,text,trans
0000000000000,ことね,お待たせしましたぁ～。,終於等到你了～。
0000000000000,{user},こんにちは、藤田さん。,你好，藤田小姐。
0000000000000,ことね,ん～っ、絶好のデート日和ですねっ！\nさぁっ、行きましょ～♪,嗯～，正是約會的好日和呢！\n來吧，我們走吧～♪
0000000000000,ことね,実はあたしぃ、遊園地にくるの、\nすっごく久しぶりなんです。,其實我好久沒來遊樂園了，\n這裡真是久違了。
0000000000000,ことね,近場にあるから、友達に誘われたりは\nしてたんですけどねぇ。,雖然附近有朋友邀請過我，\n但因為沒錢……哈哈。
0000000000000,ことね,……おカネ、なかったので……たはは。,沒錢的關係啦……謝謝你的門票。\n明明是我邀請你的……
0000000000000,ことね,チケット、ありがとうございました。\nてか、あたしが誘ったのに……,謝謝門票。\n雖然是我邀請你的……
0000000000000,{user},たまたま無料チケットを\n持っていたので。,碰巧我有一張免費的票。
0000000000000,ことね,そーんな都合のいいこと、\nあるわけないじゃないですかぁ。,怎麼可能會有這麼方便的事情啊。
0000000000000,ことね,どーせあたしのために、\n用意してくれてたんですよね。,肯定是為了我才特意準備的吧。
0000000000000,{user},家族と一緒に、休日を過ごせば……\n良い気晴らしになるのでは、と。,和家人一起度過假日……\n應該是個不錯的放鬆方式吧。
0000000000000,ことね,やっぱりぃ。ちびどもには悪いけど、\n今回は、ふたりで遊びますよ。,果然呢，雖然對不起小孩們，\n這次我們兩人玩吧。
0000000000000,ことね,デートなんですからっ！,畢竟是約會嘛！
0000000000000,ことね,あたしぃ、ジェットコースターに\n乗ってみたいです！,我想試試坐雲霄飛車！
0000000000000,ことね,目指せアトラクション全制覇！\n行きましょうプロデューサー！,目標是全制霸所有遊樂設施！\n製作人，一起去吧！
0000000000000,ことね,ひゃああぁぁぁああ～～～～～～～～！,啊啊啊啊啊啊啊啊～～～～～～～～！
0000000000000,ことね,うえぇ～～……\n気持ち悪いぃ～～～～～。,呜呜～……\n好噁心～～～～～。
0000000000000,ことね,あたしもー二度と、ジェットコースター\nなんか乗りませぇん。,我也再也不想坐雲霄飛車了。
0000000000000,ことね,つ、次は観覧車に乗りましょう！,那、那我們換摩天輪吧！
0000000000000,{user},少し休んでからにしましょう。\n顔色が真っ青ですよ。,稍微休息一下再說吧。\n你臉色都發青了。
0000000000000,ことね,えぇ～？　せっかく\n一日フリーパスなんですからぁ。,欸～？明明是一整天的通行證嘛。
0000000000000,{user},ダメです。ちょうどいい時間ですし、\n昼食にしましょう。,不行。時間正好，\n我們去吃午餐吧。
0000000000000,ことね,ぶぅ～。プロデューサーってぇ、\nほ～んと心配性ですよねぇ。,唔。製作人真是操心呢。
select,,当然です,當然啦
select,,大事な人ですから,因為是重要的人呢
select,,心配させないで\nください,請不要讓他擔心
0000000000000,ことね,……えへへ……そっかぁ。,嘿嘿……是這樣啊。
0000000000000,ことね,わっ！　そんなにハッキリ！,哇！你說得這麼明確！
0000000000000,ことね,はぁい。……えへへ……,好吧。……呵呵……
0000000000000,ことね,あたしってぇ、愛されてますネ♪,看來我是被愛著的呢♪
0000000000000,ことね,くふっ幸せ者ですね～、\nプロデューサぁ～♡,真是幸福啊～，\n製作人～♡
0000000000000,ことね,アイドルの手作り弁当を\n食べられるなんてぇ♪,居然能吃到偶像親手做的便當♪
0000000000000,ことね,えへへ～、特別にぃ、\nあーんしてあげましょ～か？,嘻嘻～，特別為你，\n要來嘴裡喂嗎？
0000000000000,{user},藤田さんは、料理も上手なのですね。,藤田小姐，你的廚藝也很厲害啊。
0000000000000,ことね,うち、わりと大家族なんでぇ。\n慣れてるんです。,我家人比較多，\n所以習慣了。
0000000000000,ことね,うあ～、太陽があったかい～。\nこのままお昼寝したくなりますねぇ。,啊～，陽光真暖和～。\n這樣讓人想睡午覺呢。
0000000000000,ことね,……懐かしいなぁ。,……好懷念啊。
0000000000000,ことね,そうそう……あのときは、お母さんが\nお弁当を作ってくれたんだっけ。,對呢……那時候媽媽\n準備的便當。
0000000000000,{user},以前にも、この場所に来たことが？,之前也來過這個地方？
0000000000000,ことね,ずっと昔……子供の頃。\n両親に、連れてきてもらったんです。,很久以前……小時候。\n父母帶我來的。
0000000000000,ことね,その頃は、あたし、まだひとりっ子で……\nもうすぐ弟か妹が生まれるんだよって。,那時候我還是獨生子……\n後來弟弟或妹妹就要出生了。
0000000000000,ことね,お姉ちゃんになるんだよ、って……,要當姊姊了呢，當時說。
0000000000000,ことね,どんなお姉ちゃんになりたい？　\nって……お父さんと、そんな話を……,想要成為怎樣的姊姊呢？\n說起來…和爸爸談這種話…
0000000000000,ことね,あたし、なんて答えたんだっけ？\n……もう、思い出せませんけど。,我當時答應了什麼來著？\n…已經想不起來了。
0000000000000,ことね,くすぐったい気持ちだったのは、\n覚えてます。,那種微妙的感覺，\n我還記得。
0000000000000,{user},………………………………,………………
0000000000000,ことね,あっ、ごめんなさい。\n電源切っておきますね。,啊，對不起。\n我先關掉電源。
0000000000000,{user},構いませんよ、出てください。,沒關係，請出去吧。
0000000000000,ことね,ありがとうございます。\nじゃあ……少しだけ失礼しまぁす。,謝謝。\n那…我就先走了。
0000000000000,ことね,――はい。なぁにぃ？　\nお姉ちゃんいま忙しいんだケドぉ～？,——怎麼了？\n姊姊現在很忙嗎～？
0000000000000,ことね,えぇ～？　彼氏とデート中～♡\nほんとだってぇ、マジマジ～♪,哎呀～？ 和男朋友約會中～♡\n真的耶，嚇到了♪
0000000000000,ことね,え？　なんで知ってんの？　\nへ～、ネット舐めてたわ。,咦？你怎麼知道的？\n哦，你在瀏覽網頁啊。
0000000000000,ことね,ひひー、だから言ったっしょ～。,嘻嘻，我不是跟你說嗎～。
0000000000000,ことね,トップアイドルに\nなってやるから、見てろよ～って。,我要成為頂尖偶像，\n你們就等著瞧吧～。
0000000000000,ことね,はーいはいっと、んじゃね。\n他のちびどもにもよろ～。,好啦好啦，那就先這樣，\n請照顧其他小朋友。
0000000000000,ことね,お待たせしましたっ。,讓你久等了。
0000000000000,{user},ご姉弟ですか？,是姊弟關係嗎？
0000000000000,ことね,噂をすれば～って、やつですね♪,所謂無風不起浪嘛♪
0000000000000,ことね,あたしが、\nネットで話題になってるの見たって。,我在網上變得有點紅了呢。
0000000000000,ことね,お姉ちゃん、アイドルみたいだねって。\nもぉ～、アイドルだってのぉ。,姊姊，看起來像偶像呢。\n我說嘛～，我就是偶像嘛。
0000000000000,ことね,ど、どうしよプロデューサー。\n……すごい嬉しい。,製作人，怎麼了？\n…真的好開心。
0000000000000,ことね,いきなり実感湧いてきたっていうか……,突然間我有點真實感了呢……
0000000000000,ことね,――あたし、アイドルになったんだ。,——我，成為偶像了。
0000000000000,{user},……………………\nプロデューサー失格ですね。,…………\n製作人不合格呢。
0000000000000,{user},藤田さんに自信を持たせる方法……\nこんなに簡単なことだったのに。,讓藤田先生充滿自信的方法…\n原來如此簡單。
0000000000000,ことね,な、なに言ってんのプロデューサー！？\n家族に褒められて自信付くとかっ！,你、你在說什麼啊製作人！？\n被家人讚美就變自信啦！
0000000000000,ことね,恥ずいじゃん！\nそんなんじゃないですからっ！,好害羞！\n才不是這樣呢！
0000000000000,ことね,あ～もぉ、いまのなし！　ぜんぶなし！\n忘れて忘れて！,啊～啊，剛才的事忘了！\n忘掉吧！
0000000000000,ことね,ほらァ、デートの続きしますよ！,來嘛，繼續約會吧！
0000000000000,{user},はい、すべて忘れました。\n……お供します。,好的，全部都忘了。\n…我陪你。
0000000000000,ことね,あ～～～、楽しかったぁ～！,啊～～～，好開心～！
0000000000000,{user},たくさん遊びましたね。,玩得很開心呢。
0000000000000,ことね,プロデューサー、\n今日はホントにありがとうございます！,製作人，\n今天真的謝謝你！
0000000000000,ことね,さいっこうの一日でした！,是最棒的一天！
0000000000000,{user},それはなにより。,比什麼都重要。
0000000000000,ことね,まぁ、アトラクション全制覇\nできなかったのは、,嘛，沒辦法全都玩遍，\n有點小遺憾。
0000000000000,ことね,ちょ～っとだけ心残りですケド。,雖然沒辦法把所有遊樂設施都玩遍，
0000000000000,{user},もう一度くればいい。,再來一次就好了。
0000000000000,ことね,また連れてきてくれるんですか？,你會再帶我來嗎？
0000000000000,{user},藤田さんが、ライブを大成功させた\n暁には、何度でも。,只要藤田先生成功舉辦演唱會，\n不管多少次都可以。
0000000000000,ことね,やたっ、約束ですよぉ～♡,耶～，你答應了～♡
0000000000000,{user},レポートをまとめなおそう。,重新整理一下報告。
0000000000000,{user},稼げるアイドルを目指して、\nどんどん成り上がっていこう！,目標是成為能賺錢的偶像，\n一步步向上爬吧！
info,adv_dear_fktn_009.txt,,
译者,gpt-3.5-turbo-0125,,