id,name,text,trans
0000000000000,咲季,ふぅ～～～～～～～～～っ！,呼～～～～～～～～～～！
0000000000000,咲季,最近の活動についての総括は、\nひとまずこんなところかしらね。,最近的活動總結，\n大概就是這樣了吧。
0000000000000,{user},お疲れ様でした、咲季さん。,辛苦了，咲季小姐。
0000000000000,咲季,プロデューサーこそ、お疲れ様。,製作人才是辛苦了。
0000000000000,咲季,さぁてっ！　次は――――,接下來――――
select,,新しいレッスン\nプランについて,關於新的課程\n計劃
select,,休養が必要です,需要休息
0000000000000,咲季,今回の総括を踏まえた\nプランに変えるのね。,基於這次的總結\n來修改計劃。
0000000000000,咲季,もちろん賛成よっ！,當然同意！
0000000000000,{user},概要はすでに作ってあります。,概要已經製作好了。
0000000000000,咲季,ありがと。すぐに確認するわ。,謝啦。我馬上確認一下。
0000000000000,{user},トレーナーとも相談の上、\nさらに詰めていきましょう。,和訓練師商量後，\n再做進一步討論。
0000000000000,咲季,焦って走り出したくなるところだけど\n……まぁ、そうよね。,雖然想要趕緊跑出去……\n嗯，對呢。
0000000000000,咲季,わかってる。ちゃんと身体を休めるわ。,知道了。我會好好休息的。
0000000000000,咲季,あなたもよ。忙しかったのは\nお互い様なんだから。,你也是。因為忙碌\n是互相的。
0000000000000,咲季,そうだ！　わたしが\nマッサージしてあげるわ！,對了！我來\n給你按摩吧！
0000000000000,咲季,光栄に思いなさいよねっ♪,要感到榮幸才對♪
0000000000000,咲季,送ってくれてありがと。ここでいいわ。,謝謝你送我回來。就到這吧。
0000000000000,咲季,ねぇ、プロデューサー。,嘿，製作人。
0000000000000,咲季,……………………あー、えっと。,……………………啊，那個。
0000000000000,咲季,あなたのおかげで……\nすごく前向きになれたわ。,多虧了你……\n我變得非常積極。
0000000000000,咲季,わたしのプロデューサーが、\nあなたでよかった。,能有你當我的製作人，\n真是太好了。
0000000000000,咲季,これからも、よろしく。,今後也請多關照。
info,adv_pstory_001_hski_ending-normal-03.txt,,
译者,gpt-3.5-turbo-0125,,