id,name,text,trans
0000000000000,あさり先生,相互理解は、プロデュースにおいて\n強力な武器となります。,相互理解在培育过程中\n是一个强大的武器。
0000000000000,あさり先生,そのために大事なのが、\n日々のコミュニケーション！,为了达到这个目标，\n日常的沟通非常重要！
0000000000000,あさり先生,というわけで、今日は雑談を\nやってみましょうねー。,所以，今天我们来聊聊天吧。
0000000000000,莉波,雑談……って言われても、\n改めて言われると難しいね。,聊天……说是聊天，\n突然这样说还真有点难呢。
0000000000000,莉波,なんでもいいから、\n話題があると嬉しいかな。,随便什么都行，\n有话题就好。
select,,歌について,关于歌唱
select,,踊りについて,关于舞蹈
select,,メイクについて,关于化妆
0000000000000,{user},最近、聴いてよかったと\n思える歌はありましたか？,最近有什么让你觉得\n很好听的歌吗？
0000000000000,莉波,そうだね……あ、あのね、\nいつもと違うジャンルなんだけど……,嗯……啊，那个啊，\n虽然是和平时不同的风格……
0000000000000,あさり先生,素直に話題に入れましたね。,你很自然地进入了话题。
0000000000000,あさり先生,普段からコミュニケーションが\nしっかり取れている証拠ですね♪,这说明你平时的沟通\n做得很到位呢♪
0000000000000,あさり先生,引き続き、絆を強めて\nいってくださいね。,继续加深彼此的\n羁绊吧。
0000000000000,{user},参考になりそうなダンスなど\nありましたか？,有没有什么值得参考的\n舞蹈呢？
0000000000000,莉波,参考っていうか……麻央のダンスって\nいつもかっこよくて。,说到参考……麻央的舞蹈总是\n特别帅气。
0000000000000,莉波,私も、格闘技を始めたら\nあんな風に動けるかなーって。,如果我也开始练格斗技的话，\n能不能也像她那样呢？
0000000000000,あさり先生,スポーツや格闘技をしている人は、\n動きにメリハリがありますからね。,从事运动或格斗的人，\n动作总是很有力度。
0000000000000,あさり先生,こんな風に、雑談から新しい\n可能性が生まれるかもしれません。,像这样，通过聊天\n可能会发现新的可能性。
0000000000000,あさり先生,アイドルとのコミュニケーションは、\nおろそかにしないでくださいね。,和偶像的沟通，一定不能\n疏忽哦。
0000000000000,{user},授業で学んでいますが、\n姫崎さんにコツを伺いたいです。,虽然在课堂上学到了，但\n想请教姫崎小姐一些技巧。
0000000000000,莉波,私が教えるの？\nふふ、いいよ。,让我来教你吗？\n呵呵，可以哦。
0000000000000,莉波,そうだなあ……ステージメイクと\n普段のお化粧の違いはわかる？,嗯……你知道舞台妆和\n日常妆的区别吗？
0000000000000,あさり先生,プロデュースする側にも\n詳しくないものはあります。,制作人也有不熟悉的领域。
0000000000000,あさり先生,変なプライドを持たず、アイドルに\n教わる姿勢は大事ですね。,不要有奇怪的自尊心，向偶像\n请教是很重要的。
0000000000000,あさり先生,この調子で、たくさん\nコミュニケーションしてくださいね♪,就这样，多多\n沟通吧♪
info,adv_pevent_001_hrnm_school_002.txt,,
译者,gpt-4o-2024-05-13,,