id,name,text,trans
0000000000000,あさり先生,篠澤さんって、異色の経歴を\n持っていますよね。,篠澤小姐有著與眾不同的經歷啊。
0000000000000,あさり先生,自分の意見をしっかり言える人ですが、\n悩みがないわけではないと思います。\n,她是一個能夠堅定地表達自己意見的人，但我認為她並不是沒有煩惱。
0000000000000,あさり先生,むしろ人からは理解されにくい悩みを\n抱えているかもしれません。,也許她背負著一些比較難被他人理解的煩惱。
0000000000000,あさり先生,万が一、そんな悩みを告白されたとき、\nどう対応すればいいか。,萬一有人坦白這樣的煩惱，要怎麼應對呢。
0000000000000,あさり先生,ちょっと考えてみましょう。,讓我想一想。
0000000000000,{user},（そもそも篠澤さんは、\n　一筋縄ではいかないからな……）,（畢竟篠澤小姐，不是那麼好搞定的人物……）
select,,レッスンをする,進行課程
select,,しっかり話を聞く,仔細聆聽
select,,友達と\n遊びに行かせる,讓她和朋友出去玩
0000000000000,あさり先生,レ、レッスンですか？,課、課程嗎？
0000000000000,{user},篠澤さんにとって、アイドル関連は\nメモリ消費が大きいものです。,對篠澤小姐來說，與偶像相關的事情會消耗很多記憶。
0000000000000,{user},レッスンで埋め尽くせば、\n上書きされてしまいます。,如果用課程填滿，就會被新的資訊覆蓋。
0000000000000,あさり先生,そこまで単純かな……,沒那麼簡單呢……
0000000000000,あさり先生,まあ、悩んでる暇もないほど\n忙しくするのは1つの方法です。,嗯，讓自己忙得沒時間煩惱也是一種方法。
0000000000000,あさり先生,あまり過激だと問題なので、\nしっかり見極めてくださいね。,不過過於激烈也會有問題，要謹慎判斷。
0000000000000,{user},篠澤さんがどういう環境で\n過ごしてきたかは知らないんですが……,我不清楚篠澤小姐是在怎樣的環境長大的……
0000000000000,{user},簡単に想像できるものでは\nないでしょう。,想像起來也不太容易。
0000000000000,{user},浅い理解で励ましたりしないよう、\nしっかりと話を聞きたいと思います。,我想要仔細聆聽，不要用膚淺的理解來鼓勵。
0000000000000,あさり先生,実際、悩みの原因は\n様々ですからね。\n,事實上，煩惱的原因各不相同。\n
0000000000000,あさり先生,場合によっては、話を聞くこと自体が\n助けになることもあります。,有時候，光是傾聽本身就能成為一種幫助。
0000000000000,あさり先生,篠澤さんのこと、\n気にかけてあげてくださいね。\n,請關心一下篠澤小姐吧。\n
0000000000000,{user},篠澤さんは年上ばかりと\n過ごしてきたんじゃないでしょうか。,篠澤小姐可能一直都只和年長的人在一起吧。
0000000000000,{user},飛び級したとなれば、同年代の\n友達と遊ぶ機会も少なかった。,如果她是跳級生，和同齡朋友一起玩的機會可能很少。
0000000000000,{user},そう考えると、単純に遊ぶという\n行為が、彼女には大事なのかも。,這麼一想，對她來說，簡單地玩耍可能很重要。
0000000000000,あさり先生,なるほど。想像であることに注意が\n必要ですが……,原來如此。要注意這只是猜測……
0000000000000,{user},ただ彼女は、自分の不安なことは\n話してくれると思っています。,我想她會和我分享她的不安。
0000000000000,あさり先生,その信頼感は大切ですね。\n悩みというものは本当に千差万別です。,這種信任感很重要。煩惱是千差萬別的。
0000000000000,あさり先生,どんな悩みでも対応できるよう、\n信頼関係を築いておきましょうね。,為了應對各種煩惱，建立信任關係很重要。
info,adv_pevent_001_shro_school_004.txt,,
译者,gpt-3.5-turbo-0125,,