id,name,text,trans
0000000000000,{user},（さて、咲季さんの様子は……）,（嗯，櫻季的狀況是……）
0000000000000,咲季,ふうっ……\n今日のレッスン終わりっ！,呼……\n今天的課程結束了！
0000000000000,咲季,あら、プロデューサー。\n見にきてくれたの？,哎呀，製作人。\n特地來看我嗎？
0000000000000,{user},お疲れ様です。咲季さん、\n調子はいかがですか？,辛苦了。櫻季，\n感覺如何？
0000000000000,咲季,すごーく悪いわっ！,狀況非常糟糕！
0000000000000,咲季,先週の方が、ずっとよく動けてた。,上週的時候，動作明顯更順暢。
select,,余裕がありますね,看起來很輕鬆呢
select,,原因は\n明らかですね,原因\n很明顯呢
select,,先週よりも\n可愛いですよ,比上週\n更可愛了呢
0000000000000,咲季,原因がはっきりしてるもの。,原因很明顯嘛。
0000000000000,咲季,動きが悪くなってるのは……\n体重を増やしたせいね。,動作變差了……\n是因為體重增加了。
0000000000000,咲季,新しい『アイドルとしての身体』を、\n使いこなせていないんだわ。,還沒能熟練運用新的『偶像身體』。
0000000000000,咲季,体重を維持しつつ、\n身体のキレを取り戻す。,要在保持體重的同時，\n恢復身體的靈活度。
0000000000000,咲季,これが次の課題ねっ！,這就是下一個課題啦！
0000000000000,{user},……これではプロデューサーの\n出る幕がありませんね。,……這樣的話，製作人\n就派不上用場了呢。
0000000000000,咲季,ひひー、落ち込まないの。\nそのうち頼らせてもらうわよ。,嘻嘻，不要沮喪。\n以後會依賴你的。
0000000000000,咲季,うん、体重を増やしたせいよね。,嗯，就是因為體重增加了。
0000000000000,咲季,全身にバランスよく、\nうっすらと脂肪を付けるイメージで――,要全身均衡地，\n稍微增加些脂肪――
0000000000000,咲季,格闘技に近い感じかなって\n思ってたんだけど……,原本想著是要有點像\n格鬥技的感覺的……
0000000000000,{user},今回は、少し筋肉量も\n減らすプランでしたね。,這次計劃稍微減少了\n肌肉量對吧。
0000000000000,咲季,色んな競技をやってきたけど……\nどれとも勝手が違ってて、苦戦中よ。,之前參加過很多比賽……\n但每一種都不同，我正在努力中。
0000000000000,咲季,身体作りができたとして……きっと\n維持するのも大変なのよね。,即使建立了身體……\n保持下去也是很辛苦的。
0000000000000,咲季,改めて……アイドルってすごいわ。,再次確認……偶像真了不起。
0000000000000,咲季,ん～っ、やる気出てきたぁ！,嗯～，有幹勁了！
0000000000000,咲季,そ、そうかしらっ？,是、是這樣嗎？
0000000000000,{user},ぐっと柔らかい印象になりました。\nとても魅力的です。,給人印象變得更柔和了。\n非常有魅力。
0000000000000,咲季,えへへぇ……実はわたしも、\nそうじゃないかなーって思ってたの。,嘿嘿……其實我也\n這麼想的。
0000000000000,{user},『アイドルとしての身体づくり』は、\n成功しています。あとは……,『偶像身體鍛鍊』，\n已經成功了。接下來……
0000000000000,咲季,身体のキレを取り戻すだけね！,只需要恢復身體的靈活度就好了！
0000000000000,咲季,う～ん、明確な課題があると楽しいわ！,嗯～，有明確的課題感覺很有趣！
0000000000000,咲季,プロデューサーも、そう思わない？,製作人也是這麼認為嗎？
info,adv_pstory_001_hski_after-step-2-normal-03.txt,,
译者,gpt-3.5-turbo-0125,,